{
  "schema_version": "1.0",
  "pre_states": [
    {"id": "new_session", "meaning": "No persisted Session exists before the turn."},
    {"id": "new_sop_session", "meaning": "A new Session can start the selected SOP."},
    {"id": "condition_step", "meaning": "The active graph node has a deterministic conditional branch."},
    {"id": "parallel_start", "meaning": "The active graph node can enqueue sibling nodes."},
    {"id": "active_plus_pending", "meaning": "One legacy task is active and at least one task is pending."},
    {"id": "multiple_turn_frames", "meaning": "Multiple legacy task frames must be processed in order."},
    {"id": "repairable_result", "meaning": "Reflection can repair the current result within budget."},
    {"id": "unrepairable_result", "meaning": "Reflection reaches its retry limit."},
    {"id": "knowledge_available", "meaning": "Local knowledge contains stable citation evidence."},
    {"id": "required_knowledge_step", "meaning": "The active SOP step requires knowledge before advance."},
    {"id": "tool_step", "meaning": "The active step allows the selected read-only tool."},
    {"id": "existing_successful_effect", "meaning": "A successful side-effect signature already exists."},
    {"id": "effect_status_unknown", "meaning": "A side-effect was started but its result is unknown."},
    {"id": "no_active_sop", "meaning": "No scene SOP is active."},
    {"id": "active_sop", "meaning": "A scene SOP is active and can invoke a General Skill."},
    {"id": "running_stream", "meaning": "A chat stream worker is executing a turn."},
    {"id": "configured_model", "meaning": "A deterministic model stub is configured."},
    {"id": "declared_handoff_step", "meaning": "The active step explicitly permits human handoff."},
    {"id": "pending_handoff", "meaning": "A persisted human handoff request is pending."},
    {"id": "draft_detected", "meaning": "Scheduled-task intent detection returns a draft."},
    {"id": "attachment_uploaded", "meaning": "A stable uploaded attachment is available to the turn."},
    {"id": "bound_channel", "meaning": "A deterministic channel binding and outbox exist."},
    {"id": "scheduled_run", "meaning": "A persisted scheduled task run is ready to execute."},
    {"id": "persisted_assistant_message", "meaning": "A committed assistant Message is visible through History and can receive feedback."}
  ],
  "steps": [
    {"id": "send", "meaning": "Submit the scenario turn request."},
    {"id": "relay", "meaning": "Consume the current legacy SSE relay."},
    {"id": "ask", "meaning": "Produce a user-visible question."},
    {"id": "history_read", "meaning": "Reload the public History projection."},
    {"id": "continue", "meaning": "Submit the next user answer."},
    {"id": "select_true_branch", "meaning": "Select the true conditional edge."},
    {"id": "select_false_branch", "meaning": "Select the false conditional edge."},
    {"id": "first_sibling", "meaning": "Execute the first parallel sibling."},
    {"id": "second_sibling", "meaning": "Execute the second parallel sibling."},
    {"id": "merge", "meaning": "Merge sibling results."},
    {"id": "complete_active", "meaning": "Complete the active legacy task."},
    {"id": "resume_pending", "meaning": "Resume the next pending legacy task."},
    {"id": "execute_frames_in_order", "meaning": "Execute all characterized frames in order."},
    {"id": "reflect", "meaning": "Run one reflection decision."},
    {"id": "retry", "meaning": "Retry the selected repair target."},
    {"id": "complete", "meaning": "Complete the scenario turn."},
    {"id": "reflect_until_limit", "meaning": "Run reflection until the configured limit."},
    {"id": "search", "meaning": "Run the local knowledge query."},
    {"id": "stream_citation", "meaning": "Observe citation-related legacy stream and message output."},
    {"id": "normalize_query", "meaning": "Normalize the required knowledge query."},
    {"id": "advance", "meaning": "Advance the active graph step."},
    {"id": "execute_read", "meaning": "Execute a read-only tool."},
    {"id": "request_same_effect", "meaning": "Request an existing side-effect signature."},
    {"id": "reuse", "meaning": "Reuse the existing effect result."},
    {"id": "start", "meaning": "Start an external action."},
    {"id": "lose_response", "meaning": "Simulate a lost action response."},
    {"id": "reconcile", "meaning": "Reconcile the unknown action status."},
    {"id": "select_skill", "meaning": "Select a General Skill."},
    {"id": "execute", "meaning": "Execute the selected capability or scheduled run."},
    {"id": "reply", "meaning": "Produce the user-visible reply."},
    {"id": "continue_sop", "meaning": "Return General Skill facts to the active SOP."},
    {"id": "disconnect_transport", "meaning": "Detach the client transport without a cancel command."},
    {"id": "reconnect_relay_after_cursor", "meaning": "Reconnect the target v1 relay after a durable cursor."},
    {"id": "await_terminal", "meaning": "Wait for the existing execution terminal state."},
    {"id": "explicit_cancel", "meaning": "Call the explicit cancellation command."},
    {"id": "raise_llm_error", "meaning": "Raise a deterministic model error."},
    {"id": "create_handoff", "meaning": "Create a pending handoff request."},
    {"id": "reply_api", "meaning": "Submit a human handoff reply through the public API."},
    {"id": "resume_worker", "meaning": "Run the legacy handoff resume worker."},
    {"id": "events_poll", "meaning": "Poll the current Session Events recovery API."},
    {"id": "stream_draft", "meaning": "Observe the legacy scheduled draft SSE event."},
    {"id": "terminal_projection", "meaning": "Observe the terminal conversation payload."},
    {"id": "confirm_draft_api", "meaning": "Confirm a scheduled draft through the current public API."},
    {"id": "send_attachment", "meaning": "Submit the stable attachment in a chat turn."},
    {"id": "ingress", "meaning": "Process deterministic channel ingress."},
    {"id": "outbox", "meaning": "Read the staged channel outbox projection."},
    {"id": "project_history", "meaning": "Project a scheduled run into chat History."},
    {"id": "feedback_up_api", "meaning": "Persist positive feedback for the assistant Message."},
    {"id": "feedback_clear_api", "meaning": "Delete persisted feedback for the assistant Message."},
    {"id": "feedback_failure_rollback", "meaning": "Characterize UI rollback when a feedback command fails."}
  ],
  "refresh_actions": [
    {"id": "history_read", "meaning": "Reload messages and Session state."},
    {"id": "continue_after_history", "meaning": "Continue a waiting SOP after History reload."},
    {"id": "open_citation_after_history", "meaning": "Open the same citation after History reload."},
    {"id": "reconnect_then_history", "meaning": "Reconnect execution delivery and verify History visibility."},
    {"id": "open_handoff_after_history", "meaning": "Open the persisted handoff after reload."},
    {"id": "reply_then_poll_history", "meaning": "Reply to handoff, poll events, and reload History."},
    {"id": "confirm_after_history", "meaning": "Confirm the restored scheduled draft."},
    {"id": "inspect_attachment_after_history", "meaning": "Inspect restored attachment metadata."},
    {"id": "feedback_after_history", "meaning": "Toggle persisted assistant feedback after History reload."}
  ]
}
